{
  "schema_version": "1.0.0",
  "thesis_id": "baba-core-thesis",
  "company": {
    "company_id": "alibaba-group",
    "name": "Alibaba Group Holding Limited",
    "ticker": "9988",
    "market": "XHKG",
    "research_status": "research"
  },
  "one_sentence_thesis": "用户确认的基准判断：若淘天重拾用户活跃后能恢复可持续变现、云业务转向公共云后兼顾增长与盈利、国际业务以规模换效率，且回购不削弱核心投入能力，则阿里巴巴的核心业务质量可逐步改善。",
  "assumptions": [
    {
      "assumption_id": "baba-a1-commerce",
      "statement": "淘天的用户优先与价格竞争策略能够持续提升购买人数、订单和高价值会员，并最终转化为客户管理收入，而不会造成长期的货币化率及分部利润恶化。",
      "indicator_ids": ["baba-i1-commerce-engagement", "baba-i2-commerce-economics"],
      "falsification_condition_ids": ["baba-f1-commerce-no-conversion"]
    },
    {
      "assumption_id": "baba-a2-cloud",
      "statement": "云智能减少低毛利项目制收入、聚焦公共云与 AI 后，收入质量和盈利能力会改善，并能逐步恢复可持续的外部客户增长。",
      "indicator_ids": ["baba-i3-cloud-quality"],
      "falsification_condition_ids": ["baba-f2-cloud-no-quality-growth"]
    },
    {
      "assumption_id": "baba-a3-international",
      "statement": "AIDC 的订单和收入高增长能够形成规模效应，使新增投入最终表现为单位经济性改善和调整后 EBITA 亏损收窄。",
      "indicator_ids": ["baba-i4-aidc-scale-and-loss"],
      "falsification_condition_ids": ["baba-f3-aidc-loss-divergence"]
    },
    {
      "assumption_id": "baba-a4-capital-allocation",
      "statement": "经营现金流和资产负债表能够同时支持核心业务投入与持续回购，并在股权激励后带来流通股净减少，而不显著削弱财务弹性。",
      "indicator_ids": ["baba-i5-cash-and-share-count"],
      "falsification_condition_ids": ["baba-f4-cash-allocation-strain"]
    }
  ],
  "key_indicators": [
    {
      "indicator_id": "baba-i1-commerce-engagement",
      "name": "淘天用户参与度",
      "why_it_matters": "购买人数、订单、购买频次和 88VIP 会员变化检验用户优先策略是否形成可持续使用行为。",
      "unit_or_definition": "同比增速及会员人数",
      "linked_assumption_ids": ["baba-a1-commerce"]
    },
    {
      "indicator_id": "baba-i2-commerce-economics",
      "name": "淘天变现与分部经济性",
      "why_it_matters": "客户管理收入、整体货币化率和调整后 EBITA 共同检验用户增长能否转化为经济价值。",
      "unit_or_definition": "同比增速、货币化率和人民币调整后 EBITA",
      "linked_assumption_ids": ["baba-a1-commerce"]
    },
    {
      "indicator_id": "baba-i3-cloud-quality",
      "name": "公共云增长与云调整后 EBITA",
      "why_it_matters": "区分低毛利项目退出造成的表面低增速与公共云、AI 产品驱动的高质量增长。",
      "unit_or_definition": "收入同比增速、产品结构和人民币调整后 EBITA",
      "linked_assumption_ids": ["baba-a2-cloud"]
    },
    {
      "indicator_id": "baba-i4-aidc-scale-and-loss",
      "name": "AIDC 订单、收入与亏损",
      "why_it_matters": "只有订单与收入增长同时带来亏损收窄，规模化假设才得到验证。",
      "unit_or_definition": "同比增速和人民币调整后 EBITA",
      "linked_assumption_ids": ["baba-a3-international"]
    },
    {
      "indicator_id": "baba-i5-cash-and-share-count",
      "name": "自由现金流与净股数变化",
      "why_it_matters": "检验资本开支和回购是否由持续现金能力支撑，并真正降低稀释后的股数。",
      "unit_or_definition": "人民币自由现金流、资本开支及稀释后净股数变化",
      "linked_assumption_ids": ["baba-a4-capital-allocation"]
    }
  ],
  "falsification_conditions": [
    {
      "condition_id": "baba-f1-commerce-no-conversion",
      "statement": "若连续两个披露期内用户与订单改善仍未带动客户管理收入，且货币化率与淘天调整后 EBITA 同时持续恶化，则该假设被显著削弱。",
      "linked_assumption_ids": ["baba-a1-commerce"]
    },
    {
      "condition_id": "baba-f2-cloud-no-quality-growth",
      "statement": "若退出低毛利项目后公共云与 AI 产品收入仍不能增长，且盈利改善主要来自不可持续的费用压缩，则该假设失效。",
      "linked_assumption_ids": ["baba-a2-cloud"]
    },
    {
      "condition_id": "baba-f3-aidc-loss-divergence",
      "statement": "若 AIDC 订单保持高增长但调整后 EBITA 亏损连续两个披露期明显扩大且无单位经济性改善证据，则规模效应假设失效。",
      "linked_assumption_ids": ["baba-a3-international"]
    },
    {
      "condition_id": "baba-f4-cash-allocation-strain",
      "statement": "若核心投入使自由现金流长期不足且回购无法在股权激励后减少净股数，或需要显著增加财务风险才能维持，则资本配置假设失效。",
      "linked_assumption_ids": ["baba-a4-capital-allocation"]
    }
  ],
  "strongest_counter_case": {
    "statement": "用户增长与业务增速可能主要由补贴、低货币化的新模式及高资本开支换来；若淘天变现承压、国际亏损扩大、云增长缓慢而自由现金流继续下降，回购只能部分掩盖核心业务回报率走弱。",
    "attacked_assumption_ids": ["baba-a1-commerce", "baba-a2-cloud", "baba-a3-international", "baba-a4-capital-allocation"],
    "basis": "基准季度已同时出现自由现金流同比下降 31%、淘天收入仅增长 2% 和云收入仅增长 3%，说明投入转化为可持续经济回报仍未被证明。",
    "evidence_ids": ["baba-base-commerce", "baba-base-cloud", "baba-base-free-cash-flow"]
  },
  "valuation_anchor": {
    "status": "insufficient_evidence",
    "insufficiency_reason": "该历史回放只使用两份官方业绩公告，未纳入截止日市场价格、完整净现金调整和经用户确认的估值方法，因此不生成估值区间。"
  },
  "unknown_questions": [
    {
      "question_id": "baba-uq1-commerce-conversion",
      "question": "淘天新增 GMV 中来自低货币化模式的比例多大，何时能转化为可持续客户管理收入？",
      "linked_assumption_ids": ["baba-a1-commerce"]
    },
    {
      "question_id": "baba-uq2-cloud-external",
      "question": "剔除阿里并表子公司后，公共云与 AI 增长何时足以抵消项目制收入退出？",
      "linked_assumption_ids": ["baba-a2-cloud"]
    },
    {
      "question_id": "baba-uq3-aidc-unit-economics",
      "question": "Choice 等跨境业务在扩大履约投入后，单位订单亏损和获客回收期如何变化？",
      "linked_assumption_ids": ["baba-a3-international"]
    }
  ],
  "tags": ["historical-replay", "alibaba", "user-confirmed"],
  "version": {
    "as_of_date": "2024-02-07",
    "version_id": "baba-thesis-v1-2024-02-07",
    "created_at": "2024-02-07T12:00:00Z",
    "updated_at": "2024-02-07T12:00:00Z",
    "supersedes": null,
    "user_confirmed": true
  }
}
